{"schema_version":"1.0","status":"pass","summary":"Prediction is schema-compliant and non-empty, with 3 cocrystal records matching the article artifacts. CSV matches JSON, RDKit canonical SMILES checks pass, numeric rates/ratios preserve reported precision, and no missed cocrystal rows or material hallucinations were found.","findings":[{"severity":"info","field":"schema","message":"output-schema validation reports 0 errors; schema_diagnostics.json has repair_count 0."},{"severity":"info","field":"records","message":"Extracted CBZ-SUC, CBZ-SAC form I, and CBZ-SAC form II; table PM/polymorph rows are present in artifacts but are not cocrystal records under the domain contract."},{"severity":"info","field":"SMILES_drug/SMILES_coformer","message":"All 6 predicted SMILES are valid RDKit canonical forms and are visually supported by Figure 1, although OCSR/chemistry_candidates did not recover these structures."},{"severity":"info","field":"photostability_change","message":"Discoloration and degradation values match Tables 1 and 2: 0.004/3.79e-5, 0.008/4.23e-5, and 0.064/1.82e-3 h^-1 with correct qualitative direction."}]}